Sheet: Лист1
A1: γ | B1: ε исх | C1: ε=0 | D1: ε=1 | E1: ε опт ППЧ
B2: 0.577 | C2: 0 | D2: 1 | E2: 0.331
A3: 0.01 | B3: of:=1/SQRT((1-[.$A3]^2)^2+4*([.B$2])^2*[.A3]^2) -> 1.00003341087436 | C3: of:=1/SQRT((1-[.$A3]^2)^2+4*([.C$2])^2*[.B3]^2) -> 1.000100010001 | D3: of:=1/SQRT((1-[.$A3]^2)^2+4*([.D$2])^2*[.C3]^2) -> 0.447186759285494 | E3: of:=1/SQRT((1-[.$A3]^2)^2+4*([.E$2])^2*[.D3]^2) -> 0.958953810694003
A4: 0.05 | B4: of:=1/SQRT((1-[.$A4]^2)^2+4*([.B$2])^2*[.A4]^2) -> 1.00083327035328 | C4: of:=1/SQRT((1-[.$A4]^2)^2+4*([.C$2])^2*[.B4]^2) -> 1.00250626566416 | D4: of:=1/SQRT((1-[.$A4]^2)^2+4*([.D$2])^2*[.C4]^2) -> 0.446540652247909 | E4: of:=1/SQRT((1-[.$A4]^2)^2+4*([.E$2])^2*[.D4]^2) -> 0.961186847548473
A5: 0.1 | B5: of:=1/SQRT((1-[.$A5]^2)^2+4*([.B$2])^2*[.A5]^2) -> 1.0033077598285 | C5: of:=1/SQRT((1-[.$A5]^2)^2+4*([.C$2])^2*[.B5]^2) -> 1.01010101010101 | D5: of:=1/SQRT((1-[.$A5]^2)^2+4*([.D$2])^2*[.C5]^2) -> 0.444496417238892 | E5: of:=1/SQRT((1-[.$A5]^2)^2+4*([.E$2])^2*[.D5]^2) -> 0.968236624771194
A6: 0.2 | B6: of:=1/SQRT((1-[.$A6]^2)^2+4*([.B$2])^2*[.A6]^2) -> 1.01280759625663 | C6: of:=1/SQRT((1-[.$A6]^2)^2+4*([.C$2])^2*[.B6]^2) -> 1.04166666666667 | D6: of:=1/SQRT((1-[.$A6]^2)^2+4*([.D$2])^2*[.C6]^2) -> 0.435942913080137 | E6: of:=1/SQRT((1-[.$A6]^2)^2+4*([.E$2])^2*[.D6]^2) -> 0.997565609747497
A7: 0.4 | B7: of:=1/SQRT((1-[.$A7]^2)^2+4*([.B$2])^2*[.A7]^2) -> 1.04332389727275 | C7: of:=1/SQRT((1-[.$A7]^2)^2+4*([.C$2])^2*[.B7]^2) -> 1.19047619047619 | D7: of:=1/SQRT((1-[.$A7]^2)^2+4*([.D$2])^2*[.C7]^2) -> 0.396073486085788 | E7: of:=1/SQRT((1-[.$A7]^2)^2+4*([.E$2])^2*[.D7]^2) -> 1.13640092535027
A8: 0.6 | B8: of:=1/SQRT((1-[.$A8]^2)^2+4*([.B$2])^2*[.A8]^2) -> 1.06058329288329 | C8: of:=1/SQRT((1-[.$A8]^2)^2+4*([.C$2])^2*[.B8]^2) -> 1.5625 | D8: of:=1/SQRT((1-[.$A8]^2)^2+4*([.D$2])^2*[.C8]^2) -> 0.31349310209025 | E8: of:=1/SQRT((1-[.$A8]^2)^2+4*([.E$2])^2*[.D8]^2) -> 1.48630959699674
A9: 0.8 | B9: of:=1/SQRT((1-[.$A9]^2)^2+4*([.B$2])^2*[.A9]^2) -> 1.00917564107321 | C9: of:=1/SQRT((1-[.$A9]^2)^2+4*([.C$2])^2*[.B9]^2) -> 2.77777777777778 | D9: of:=1/SQRT((1-[.$A9]^2)^2+4*([.D$2])^2*[.C9]^2) -> 0.179623272406393 | E9: of:=1/SQRT((1-[.$A9]^2)^2+4*([.E$2])^2*[.D9]^2) -> 2.63761609441229
A10: 1 | B10: of:=1/SQRT((1-[.$A10]^2)^2+4*([.B$2])^2*[.A10]^2) -> 0.866551126516464 | C10: of:=1/SQRT((1-[.$A10]^2)^2+4*([.C$2])^2*[.B10]^2) ->  | D10: of:=1/SQRT((1-[.$A10]^2)^2+4*([.D$2])^2*[.C10]^2) ->  | E10: of:=1/SQRT((1-[.$A10]^2)^2+4*([.E$2])^2*[.D10]^2) -> 
A11: 1.2 | B11: of:=1/SQRT((1-[.$A11]^2)^2+4*([.B$2])^2*[.A11]^2) -> 0.688221133737715 | C11: of:=1/SQRT((1-[.$A11]^2)^2+4*([.C$2])^2*[.B11]^2) -> 2.27272727272727 | D11: of:=1/SQRT((1-[.$A11]^2)^2+4*([.D$2])^2*[.C11]^2) -> 0.218976461113167 | E11: of:=1/SQRT((1-[.$A11]^2)^2+4*([.E$2])^2*[.D11]^2) -> 2.15859353417067
A12: 1.4 | B12: of:=1/SQRT((1-[.$A12]^2)^2+4*([.B$2])^2*[.A12]^2) -> 0.532113407261127 | C12: of:=1/SQRT((1-[.$A12]^2)^2+4*([.C$2])^2*[.B12]^2) -> 1.04166666666667 | D12: of:=1/SQRT((1-[.$A12]^2)^2+4*([.D$2])^2*[.C12]^2) -> 0.435942913080137 | E12: of:=1/SQRT((1-[.$A12]^2)^2+4*([.E$2])^2*[.D12]^2) -> 0.997565609747497
A13: 1.6 | B13: of:=1/SQRT((1-[.$A13]^2)^2+4*([.B$2])^2*[.A13]^2) -> 0.413704029858401 | C13: of:=1/SQRT((1-[.$A13]^2)^2+4*([.C$2])^2*[.B13]^2) -> 0.641025641025641 | D13: of:=1/SQRT((1-[.$A13]^2)^2+4*([.D$2])^2*[.C13]^2) -> 0.495240367185006 | E13: of:=1/SQRT((1-[.$A13]^2)^2+4*([.E$2])^2*[.D13]^2) -> 0.627321828503271
A14: 1.8 | B14: of:=1/SQRT((1-[.$A14]^2)^2+4*([.B$2])^2*[.A14]^2) -> 0.327343907251559 | C14: of:=1/SQRT((1-[.$A14]^2)^2+4*([.C$2])^2*[.B14]^2) -> 0.446428571428571 | D14: of:=1/SQRT((1-[.$A14]^2)^2+4*([.D$2])^2*[.C14]^2) -> 0.414698856424451 | E14: of:=1/SQRT((1-[.$A14]^2)^2+4*([.E$2])^2*[.D14]^2) -> 0.443113075772483
A15: 2 | B15: of:=1/SQRT((1-[.$A15]^2)^2+4*([.B$2])^2*[.A15]^2) -> 0.264194900657393 | C15: of:=1/SQRT((1-[.$A15]^2)^2+4*([.C$2])^2*[.B15]^2) -> 0.333333333333333 | D15: of:=1/SQRT((1-[.$A15]^2)^2+4*([.D$2])^2*[.C15]^2) -> 0.325395686727984 | E15: of:=1/SQRT((1-[.$A15]^2)^2+4*([.E$2])^2*[.D15]^2) -> 0.332477339959586
A16: 4 | B16: of:=1/SQRT((1-[.$A16]^2)^2+4*([.B$2])^2*[.A16]^2) -> 0.0637178657721378 | C16: of:=1/SQRT((1-[.$A16]^2)^2+4*([.C$2])^2*[.B16]^2) -> 0.0666666666666667 | D16: of:=1/SQRT((1-[.$A16]^2)^2+4*([.D$2])^2*[.C16]^2) -> 0.0666640330778742 | E16: of:=1/SQRT((1-[.$A16]^2)^2+4*([.E$2])^2*[.D16]^2) -> 0.0666663781356173
A17: 6 | B17: of:=1/SQRT((1-[.$A17]^2)^2+4*([.B$2])^2*[.A17]^2) -> 0.0280282337133485 | C17: of:=1/SQRT((1-[.$A17]^2)^2+4*([.C$2])^2*[.B17]^2) -> 0.0285714285714286 | D17: of:=1/SQRT((1-[.$A17]^2)^2+4*([.D$2])^2*[.C17]^2) -> 0.028571390492133 | E17: of:=1/SQRT((1-[.$A17]^2)^2+4*([.E$2])^2*[.D17]^2) -> 0.0285714243994266
A18: 8 | B18: of:=1/SQRT((1-[.$A18]^2)^2+4*([.B$2])^2*[.A18]^2) -> 0.0157052848591045 | C18: of:=1/SQRT((1-[.$A18]^2)^2+4*([.C$2])^2*[.B18]^2) -> 0.0158730158730159 | D18: of:=1/SQRT((1-[.$A18]^2)^2+4*([.D$2])^2*[.C18]^2) -> 0.0158730138577741 | E18: of:=1/SQRT((1-[.$A18]^2)^2+4*([.E$2])^2*[.D18]^2) -> 0.015873015652224