Sheet: Лист1
A1: γ | B1: ε исх | C1: ε=0 | D1: ε=1 | E1: ε опт ППЧ
B2: 0.577 | C2: 0 | D2: 1 | E2: 0.331
A3: 0.01 | B3: of:=1/SQRT((1-[.$A3]^2)^2+4*([.B$2])^2*[.$A3]^2) -> 1.00003341087436 | C3: of:=1/SQRT((1-[.$A3]^2)^2+4*([.C$2])^2*[.$A3]^2) -> 1.000100010001 | D3: of:=1/SQRT((1-[.$A3]^2)^2+4*([.D$2])^2*[.$A3]^2) -> 0.999900009999 | E3: of:=1/SQRT((1-[.$A3]^2)^2+4*([.E$2])^2*[.$A3]^2) -> 1.00007809194658
A4: 0.05 | B4: of:=1/SQRT((1-[.$A4]^2)^2+4*([.B$2])^2*[.$A4]^2) -> 1.00083327035328 | C4: of:=1/SQRT((1-[.$A4]^2)^2+4*([.C$2])^2*[.$A4]^2) -> 1.00250626566416 | D4: of:=1/SQRT((1-[.$A4]^2)^2+4*([.D$2])^2*[.$A4]^2) -> 0.997506234413965 | E4: of:=1/SQRT((1-[.$A4]^2)^2+4*([.E$2])^2*[.$A4]^2) -> 1.00195478688483
A5: 0.1 | B5: of:=1/SQRT((1-[.$A5]^2)^2+4*([.B$2])^2*[.$A5]^2) -> 1.0033077598285 | C5: of:=1/SQRT((1-[.$A5]^2)^2+4*([.C$2])^2*[.$A5]^2) -> 1.01010101010101 | D5: of:=1/SQRT((1-[.$A5]^2)^2+4*([.D$2])^2*[.$A5]^2) -> 0.99009900990099 | E5: of:=1/SQRT((1-[.$A5]^2)^2+4*([.E$2])^2*[.$A5]^2) -> 1.00785026175026
A6: 0.2 | B6: of:=1/SQRT((1-[.$A6]^2)^2+4*([.B$2])^2*[.$A6]^2) -> 1.01280759625663 | C6: of:=1/SQRT((1-[.$A6]^2)^2+4*([.C$2])^2*[.$A6]^2) -> 1.04166666666667 | D6: of:=1/SQRT((1-[.$A6]^2)^2+4*([.D$2])^2*[.$A6]^2) -> 0.961538461538461 | E6: of:=1/SQRT((1-[.$A6]^2)^2+4*([.E$2])^2*[.$A6]^2) -> 1.03189901633083
A7: 0.4 | B7: of:=1/SQRT((1-[.$A7]^2)^2+4*([.B$2])^2*[.$A7]^2) -> 1.04332389727275 | C7: of:=1/SQRT((1-[.$A7]^2)^2+4*([.C$2])^2*[.$A7]^2) -> 1.19047619047619 | D7: of:=1/SQRT((1-[.$A7]^2)^2+4*([.D$2])^2*[.$A7]^2) -> 0.862068965517241 | E7: of:=1/SQRT((1-[.$A7]^2)^2+4*([.E$2])^2*[.$A7]^2) -> 1.13539708356185
A8: 0.6 | B8: of:=1/SQRT((1-[.$A8]^2)^2+4*([.B$2])^2*[.$A8]^2) -> 1.06058329288329 | C8: of:=1/SQRT((1-[.$A8]^2)^2+4*([.C$2])^2*[.$A8]^2) -> 1.5625 | D8: of:=1/SQRT((1-[.$A8]^2)^2+4*([.D$2])^2*[.$A8]^2) -> 0.735294117647059 | E8: of:=1/SQRT((1-[.$A8]^2)^2+4*([.E$2])^2*[.$A8]^2) -> 1.3276012187888
A9: 0.8 | B9: of:=1/SQRT((1-[.$A9]^2)^2+4*([.B$2])^2*[.$A9]^2) -> 1.00917564107321 | C9: of:=1/SQRT((1-[.$A9]^2)^2+4*([.C$2])^2*[.$A9]^2) -> 2.77777777777778 | D9: of:=1/SQRT((1-[.$A9]^2)^2+4*([.D$2])^2*[.$A9]^2) -> 0.609756097560976 | E9: of:=1/SQRT((1-[.$A9]^2)^2+4*([.E$2])^2*[.$A9]^2) -> 1.56159258794828
A10: 1 | B10: of:=1/SQRT((1-[.$A10]^2)^2+4*([.B$2])^2*[.$A10]^2) -> 0.866551126516464 | C10: of:=1/SQRT((1-[.$A10]^2)^2+4*([.C$2])^2*[.$A10]^2) ->  | D10: of:=1/SQRT((1-[.$A10]^2)^2+4*([.D$2])^2*[.$A10]^2) -> 0.5 | E10: of:=1/SQRT((1-[.$A10]^2)^2+4*([.E$2])^2*[.$A10]^2) -> 1.51057401812689
A11: 1.2 | B11: of:=1/SQRT((1-[.$A11]^2)^2+4*([.B$2])^2*[.$A11]^2) -> 0.688221133737715 | C11: of:=1/SQRT((1-[.$A11]^2)^2+4*([.C$2])^2*[.$A11]^2) -> 2.27272727272727 | D11: of:=1/SQRT((1-[.$A11]^2)^2+4*([.D$2])^2*[.$A11]^2) -> 0.40983606557377 | E11: of:=1/SQRT((1-[.$A11]^2)^2+4*([.E$2])^2*[.$A11]^2) -> 1.10118311595457
A12: 1.4 | B12: of:=1/SQRT((1-[.$A12]^2)^2+4*([.B$2])^2*[.$A12]^2) -> 0.532113407261127 | C12: of:=1/SQRT((1-[.$A12]^2)^2+4*([.C$2])^2*[.$A12]^2) -> 1.04166666666667 | D12: of:=1/SQRT((1-[.$A12]^2)^2+4*([.D$2])^2*[.$A12]^2) -> 0.337837837837838 | E12: of:=1/SQRT((1-[.$A12]^2)^2+4*([.E$2])^2*[.$A12]^2) -> 0.749414183327859
A13: 1.6 | B13: of:=1/SQRT((1-[.$A13]^2)^2+4*([.B$2])^2*[.$A13]^2) -> 0.413704029858401 | C13: of:=1/SQRT((1-[.$A13]^2)^2+4*([.C$2])^2*[.$A13]^2) -> 0.641025641025641 | D13: of:=1/SQRT((1-[.$A13]^2)^2+4*([.D$2])^2*[.$A13]^2) -> 0.280898876404494 | E13: of:=1/SQRT((1-[.$A13]^2)^2+4*([.E$2])^2*[.$A13]^2) -> 0.530333883094107
A14: 1.8 | B14: of:=1/SQRT((1-[.$A14]^2)^2+4*([.B$2])^2*[.$A14]^2) -> 0.327343907251559 | C14: of:=1/SQRT((1-[.$A14]^2)^2+4*([.C$2])^2*[.$A14]^2) -> 0.446428571428571 | D14: of:=1/SQRT((1-[.$A14]^2)^2+4*([.D$2])^2*[.$A14]^2) -> 0.235849056603774 | E14: of:=1/SQRT((1-[.$A14]^2)^2+4*([.E$2])^2*[.$A14]^2) -> 0.394131388001581
A15: 2 | B15: of:=1/SQRT((1-[.$A15]^2)^2+4*([.B$2])^2*[.$A15]^2) -> 0.264194900657393 | C15: of:=1/SQRT((1-[.$A15]^2)^2+4*([.C$2])^2*[.$A15]^2) -> 0.333333333333333 | D15: of:=1/SQRT((1-[.$A15]^2)^2+4*([.D$2])^2*[.$A15]^2) -> 0.2 | E15: of:=1/SQRT((1-[.$A15]^2)^2+4*([.E$2])^2*[.$A15]^2) -> 0.304954932150039
A16: 4 | B16: of:=1/SQRT((1-[.$A16]^2)^2+4*([.B$2])^2*[.$A16]^2) -> 0.0637178657721378 | C16: of:=1/SQRT((1-[.$A16]^2)^2+4*([.C$2])^2*[.$A16]^2) -> 0.0666666666666667 | D16: of:=1/SQRT((1-[.$A16]^2)^2+4*([.D$2])^2*[.$A16]^2) -> 0.0588235294117647 | E16: of:=1/SQRT((1-[.$A16]^2)^2+4*([.E$2])^2*[.$A16]^2) -> 0.0656515321500897
A17: 6 | B17: of:=1/SQRT((1-[.$A17]^2)^2+4*([.B$2])^2*[.$A17]^2) -> 0.0280282337133485 | C17: of:=1/SQRT((1-[.$A17]^2)^2+4*([.C$2])^2*[.$A17]^2) -> 0.0285714285714286 | D17: of:=1/SQRT((1-[.$A17]^2)^2+4*([.D$2])^2*[.$A17]^2) -> 0.027027027027027 | E17: of:=1/SQRT((1-[.$A17]^2)^2+4*([.E$2])^2*[.$A17]^2) -> 0.0283892010572583
A18: 8 | B18: of:=1/SQRT((1-[.$A18]^2)^2+4*([.B$2])^2*[.$A18]^2) -> 0.0157052848591045 | C18: of:=1/SQRT((1-[.$A18]^2)^2+4*([.C$2])^2*[.$A18]^2) -> 0.0158730158730159 | D18: of:=1/SQRT((1-[.$A18]^2)^2+4*([.D$2])^2*[.$A18]^2) -> 0.0153846153846154 | E18: of:=1/SQRT((1-[.$A18]^2)^2+4*([.E$2])^2*[.$A18]^2) -> 0.0158172266942415