Sheet: В радианах
A1: γ | B1: ε исх | C1: ε=0 | D1: ε=1 | E1: ε опт ППЧ
B2: 0.5 | C2: 0 | D2: 1 | E2: 0.59
A3: 0.01 | B3: of:=-ATAN((2*[.B$2]*[.$A3])/(1-([.$A3])^2)) -> -0.0100006666866652 | C3: of:=-ATAN((2*[.C$2]*[.$A3])/(1-([.$A3])^2)) -> -0 | D3: of:=-ATAN((2*[.D$2]*[.$A3])/(1-([.$A3])^2)) -> -0.0199993333733305 | E3: of:=-ATAN((2*[.E$2]*[.$A3])/(1-([.$A3])^2)) -> -0.0118006323221159
A4: 0.05 | B4: of:=-ATAN((2*[.B$2]*[.$A4])/(1-([.$A4])^2)) -> -0.0500833957212917 | C4: of:=-ATAN((2*[.C$2]*[.$A4])/(1-([.$A4])^2)) -> -0 | D4: of:=-ATAN((2*[.D$2]*[.$A4])/(1-([.$A4])^2)) -> -0.0999167914438855 | E4: of:=-ATAN((2*[.E$2]*[.$A4])/(1-([.$A4])^2)) -> -0.0590790384068739
A5: 0.1 | B5: of:=-ATAN((2*[.B$2]*[.$A5])/(1-([.$A5])^2)) -> -0.100668652157829 | C5: of:=-ATAN((2*[.C$2]*[.$A5])/(1-([.$A5])^2)) -> -0 | D5: of:=-ATAN((2*[.D$2]*[.$A5])/(1-([.$A5])^2)) -> -0.199337304982324 | E5: of:=-ATAN((2*[.E$2]*[.$A5])/(1-([.$A5])^2)) -> -0.118632240399767
A6: 0.2 | B6: of:=-ATAN((2*[.B$2]*[.$A6])/(1-([.$A6])^2)) -> -0.205395389189767 | C6: of:=-ATAN((2*[.C$2]*[.$A6])/(1-([.$A6])^2)) -> -0 | D6: of:=-ATAN((2*[.D$2]*[.$A6])/(1-([.$A6])^2)) -> -0.394791119699762 | E6: of:=-ATAN((2*[.E$2]*[.$A6])/(1-([.$A6])^2)) -> -0.241053266213232
A7: 0.4 | B7: of:=-ATAN((2*[.B$2]*[.$A7])/(1-([.$A7])^2)) -> -0.444419209901099 | C7: of:=-ATAN((2*[.C$2]*[.$A7])/(1-([.$A7])^2)) -> -0 | D7: of:=-ATAN((2*[.D$2]*[.$A7])/(1-([.$A7])^2)) -> -0.76101275422473 | E7: of:=-ATAN((2*[.E$2]*[.$A7])/(1-([.$A7])^2)) -> -0.511937176307204
A8: 0.6 | B8: of:=-ATAN((2*[.B$2]*[.$A8])/(1-([.$A8])^2)) -> -0.753151280962195 | C8: of:=-ATAN((2*[.C$2]*[.$A8])/(1-([.$A8])^2)) -> -0 | D8: of:=-ATAN((2*[.D$2]*[.$A8])/(1-([.$A8])^2)) -> -1.08083900054117 | E8: of:=-ATAN((2*[.E$2]*[.$A8])/(1-([.$A8])^2)) -> -0.835800543106794
A9: 0.8 | B9: of:=-ATAN((2*[.B$2]*[.$A9])/(1-([.$A9])^2)) -> -1.14794240066196 | C9: of:=-ATAN((2*[.C$2]*[.$A9])/(1-([.$A9])^2)) -> -0 | D9: of:=-ATAN((2*[.D$2]*[.$A9])/(1-([.$A9])^2)) -> -1.34948188444711 | E9: of:=-ATAN((2*[.E$2]*[.$A9])/(1-([.$A9])^2)) -> -1.20646500948236
A10: 1 | B10: of:=-ATAN((2*[.B$2]*[.$A10])/(1-([.$A10])^2)) ->  | C10: of:=-ATAN((2*[.C$2]*[.$A10])/(1-([.$A10])^2)) ->  | D10: of:=-ATAN((2*[.D$2]*[.$A10])/(1-([.$A10])^2)) ->  | E10: of:=-ATAN((2*[.E$2]*[.$A10])/(1-([.$A10])^2)) -> 
A11: 1.2 | B11: of:=-ATAN((2*[.B$2]*[.$A11])/(1-([.$A11])^2)) -> 1.21935153279135 | C11: of:=-ATAN((2*[.C$2]*[.$A11])/(1-([.$A11])^2)) -> 0 | D11: of:=-ATAN((2*[.D$2]*[.$A11])/(1-([.$A11])^2)) -> 1.38947655239341 | E11: of:=-ATAN((2*[.E$2]*[.$A11])/(1-([.$A11])^2)) -> 1.26952072642242
A12: 1.4 | B12: of:=-ATAN((2*[.B$2]*[.$A12])/(1-([.$A12])^2)) -> 0.969722572297147 | C12: of:=-ATAN((2*[.C$2]*[.$A12])/(1-([.$A12])^2)) -> 0 | D12: of:=-ATAN((2*[.D$2]*[.$A12])/(1-([.$A12])^2)) -> 1.24049897196564 | E12: of:=-ATAN((2*[.E$2]*[.$A12])/(1-([.$A12])^2)) -> 1.04437950192566
A13: 1.6 | B13: of:=-ATAN((2*[.B$2]*[.$A13])/(1-([.$A13])^2)) -> 0.7980557152315 | C13: of:=-ATAN((2*[.C$2]*[.$A13])/(1-([.$A13])^2)) -> 0 | D13: of:=-ATAN((2*[.D$2]*[.$A13])/(1-([.$A13])^2)) -> 1.11719863068712 | E13: of:=-ATAN((2*[.E$2]*[.$A13])/(1-([.$A13])^2)) -> 0.88024037669345
A14: 1.8 | B14: of:=-ATAN((2*[.B$2]*[.$A14])/(1-([.$A14])^2)) -> 0.676914851842477 | C14: of:=-ATAN((2*[.C$2]*[.$A14])/(1-([.$A14])^2)) -> 0 | D14: of:=-ATAN((2*[.D$2]*[.$A14])/(1-([.$A14])^2)) -> 1.01419700878467 | E14: of:=-ATAN((2*[.E$2]*[.$A14])/(1-([.$A14])^2)) -> 0.758823302852839
A15: 2 | B15: of:=-ATAN((2*[.B$2]*[.$A15])/(1-([.$A15])^2)) -> 0.588002603547568 | C15: of:=-ATAN((2*[.C$2]*[.$A15])/(1-([.$A15])^2)) -> 0 | D15: of:=-ATAN((2*[.D$2]*[.$A15])/(1-([.$A15])^2)) -> 0.927295218001612 | E15: of:=-ATAN((2*[.E$2]*[.$A15])/(1-([.$A15])^2)) -> 0.666557818829683
A16: 4 | B16: of:=-ATAN((2*[.B$2]*[.$A16])/(1-([.$A16])^2)) -> 0.260602391747341 | C16: of:=-ATAN((2*[.C$2]*[.$A16])/(1-([.$A16])^2)) -> 0 | D16: of:=-ATAN((2*[.D$2]*[.$A16])/(1-([.$A16])^2)) -> 0.489957326253728 | E16: of:=-ATAN((2*[.E$2]*[.$A16])/(1-([.$A16])^2)) -> 0.30485755170379
A17: 6 | B17: of:=-ATAN((2*[.B$2]*[.$A17])/(1-([.$A17])^2)) -> 0.169778273968338 | C17: of:=-ATAN((2*[.C$2]*[.$A17])/(1-([.$A17])^2)) -> 0 | D17: of:=-ATAN((2*[.D$2]*[.$A17])/(1-([.$A17])^2)) -> 0.330297354829254 | E17: of:=-ATAN((2*[.E$2]*[.$A17])/(1-([.$A17])^2)) -> 0.199592392871207
A18: 8 | B18: of:=-ATAN((2*[.B$2]*[.$A18])/(1-([.$A18])^2)) -> 0.12630811706324 | C18: of:=-ATAN((2*[.C$2]*[.$A18])/(1-([.$A18])^2)) -> 0 | D18: of:=-ATAN((2*[.D$2]*[.$A18])/(1-([.$A18])^2)) -> 0.248709989093523 | E18: of:=-ATAN((2*[.E$2]*[.$A18])/(1-([.$A18])^2)) -> 0.148734706676815

Sheet: В градусах
A1: γ | B1: ε исх | C1: ε=0 | D1: ε=1 | E1: ε опт ППЧ
B2: 0.577 | C2: 0 | D2: 1 | E2: 0.331
A3: 0.01 | B3: of:=(-ATAN((2*[.B$2]*[.$A3])/(1-([.$A3])^2)))*180/3.14159 -> -0.66123062285689 | C3: of:=(-ATAN((2*[.C$2]*[.$A3])/(1-([.$A3])^2)))*180/3.14159 -> -0 | D3: of:=(-ATAN((2*[.D$2]*[.$A3])/(1-([.$A3])^2)))*180/3.14159 -> -1.14587836324902 | E3: of:=(-ATAN((2*[.E$2]*[.$A3])/(1-([.$A3])^2)))*180/3.14159 -> -0.379330772029539
A4: 0.05 | B4: of:=(-ATAN((2*[.B$2]*[.$A4])/(1-([.$A4])^2)))*180/3.14159 -> -3.31056581304309 | C4: of:=(-ATAN((2*[.C$2]*[.$A4])/(1-([.$A4])^2)))*180/3.14159 -> -0 | D4: of:=(-ATAN((2*[.D$2]*[.$A4])/(1-([.$A4])^2)))*180/3.14159 -> -5.7248152877681 | E4: of:=(-ATAN((2*[.E$2]*[.$A4])/(1-([.$A4])^2)))*180/3.14159 -> -1.90054765120397
A5: 0.1 | B5: of:=(-ATAN((2*[.B$2]*[.$A5])/(1-([.$A5])^2)))*180/3.14159 -> -6.64872085895951 | C5: of:=(-ATAN((2*[.C$2]*[.$A5])/(1-([.$A5])^2)))*180/3.14159 -> -0 | D5: of:=(-ATAN((2*[.D$2]*[.$A5])/(1-([.$A5])^2)))*180/3.14159 -> -11.4211959220708 | E5: of:=(-ATAN((2*[.E$2]*[.$A5])/(1-([.$A5])^2)))*180/3.14159 -> -3.82560159952856
A6: 0.2 | B6: of:=(-ATAN((2*[.B$2]*[.$A6])/(1-([.$A6])^2)))*180/3.14159 -> -13.5183155985656 | C6: of:=(-ATAN((2*[.C$2]*[.$A6])/(1-([.$A6])^2)))*180/3.14159 -> -0 | D6: of:=(-ATAN((2*[.D$2]*[.$A6])/(1-([.$A6])^2)))*180/3.14159 -> -22.6198840542391 | E6: of:=(-ATAN((2*[.E$2]*[.$A6])/(1-([.$A6])^2)))*180/3.14159 -> -7.85251208716322
A7: 0.4 | B7: of:=(-ATAN((2*[.B$2]*[.$A7])/(1-([.$A7])^2)))*180/3.14159 -> -28.7898666668108 | C7: of:=(-ATAN((2*[.C$2]*[.$A7])/(1-([.$A7])^2)))*180/3.14159 -> -0 | D7: of:=(-ATAN((2*[.D$2]*[.$A7])/(1-([.$A7])^2)))*180/3.14159 -> -43.6028558024603 | E7: of:=(-ATAN((2*[.E$2]*[.$A7])/(1-([.$A7])^2)))*180/3.14159 -> -17.4968516828683
A8: 0.6 | B8: of:=(-ATAN((2*[.B$2]*[.$A8])/(1-([.$A8])^2)))*180/3.14159 -> -47.2521807419547 | C8: of:=(-ATAN((2*[.C$2]*[.$A8])/(1-([.$A8])^2)))*180/3.14159 -> -0 | D8: of:=(-ATAN((2*[.D$2]*[.$A8])/(1-([.$A8])^2)))*180/3.14159 -> -61.9275653721238 | E8: of:=(-ATAN((2*[.E$2]*[.$A8])/(1-([.$A8])^2)))*180/3.14159 -> -31.8247991675738
A9: 0.8 | B9: of:=(-ATAN((2*[.B$2]*[.$A9])/(1-([.$A9])^2)))*180/3.14159 -> -68.6968601520173 | C9: of:=(-ATAN((2*[.C$2]*[.$A9])/(1-([.$A9])^2)))*180/3.14159 -> -0 | D9: of:=(-ATAN((2*[.D$2]*[.$A9])/(1-([.$A9])^2)))*180/3.14159 -> -77.3196818173215 | E9: of:=(-ATAN((2*[.E$2]*[.$A9])/(1-([.$A9])^2)))*180/3.14159 -> -55.7938153712751
A10: 1 | B10: of:=(-ATAN((2*[.B$2]*[.$A10])/(1-([.$A10])^2)))*180/3.14159 ->  | C10: of:=(-ATAN((2*[.C$2]*[.$A10])/(1-([.$A10])^2)))*180/3.14159 ->  | D10: of:=(-ATAN((2*[.D$2]*[.$A10])/(1-([.$A10])^2)))*180/3.14159 ->  | E10: of:=(-ATAN((2*[.E$2]*[.$A10])/(1-([.$A10])^2)))*180/3.14159 -> 
A11: 1.2 | B11: of:=(-ATAN((2*[.B$2]*[.$A11])/(1-([.$A11])^2)))*180/3.14159 -> 72.3731656671098 | C11: of:=(-ATAN((2*[.C$2]*[.$A11])/(1-([.$A11])^2)))*180/3.14159 -> 0 | D11: of:=(-ATAN((2*[.D$2]*[.$A11])/(1-([.$A11])^2)))*180/3.14159 -> 79.6112094292423 | E11: of:=(-ATAN((2*[.E$2]*[.$A11])/(1-([.$A11])^2)))*180/3.14159 -> 61.0189852373627
A12: 1.4 | B12: of:=(-ATAN((2*[.B$2]*[.$A12])/(1-([.$A12])^2)))*180/3.14159 -> 59.2809938669648 | C12: of:=(-ATAN((2*[.C$2]*[.$A12])/(1-([.$A12])^2)))*180/3.14159 -> 0 | D12: of:=(-ATAN((2*[.D$2]*[.$A12])/(1-([.$A12])^2)))*180/3.14159 -> 71.075415618784 | E12: of:=(-ATAN((2*[.E$2]*[.$A12])/(1-([.$A12])^2)))*180/3.14159 -> 43.9919686845069
A13: 1.6 | B13: of:=(-ATAN((2*[.B$2]*[.$A13])/(1-([.$A13])^2)))*180/3.14159 -> 49.8059980451555 | C13: of:=(-ATAN((2*[.C$2]*[.$A13])/(1-([.$A13])^2)))*180/3.14159 -> 0 | D13: of:=(-ATAN((2*[.D$2]*[.$A13])/(1-([.$A13])^2)))*180/3.14159 -> 64.010820483794 | E13: of:=(-ATAN((2*[.E$2]*[.$A13])/(1-([.$A13])^2)))*180/3.14159 -> 34.175527955325
A14: 1.8 | B14: of:=(-ATAN((2*[.B$2]*[.$A14])/(1-([.$A14])^2)))*180/3.14159 -> 42.8404569981525 | C14: of:=(-ATAN((2*[.C$2]*[.$A14])/(1-([.$A14])^2)))*180/3.14159 -> 0 | D14: of:=(-ATAN((2*[.D$2]*[.$A14])/(1-([.$A14])^2)))*180/3.14159 -> 58.1092572809441 | E14: of:=(-ATAN((2*[.E$2]*[.$A14])/(1-([.$A14])^2)))*180/3.14159 -> 28.0114061730289
A15: 2 | B15: of:=(-ATAN((2*[.B$2]*[.$A15])/(1-([.$A15])^2)))*180/3.14159 -> 37.5723155031703 | C15: of:=(-ATAN((2*[.C$2]*[.$A15])/(1-([.$A15])^2)))*180/3.14159 -> 0 | D15: of:=(-ATAN((2*[.D$2]*[.$A15])/(1-([.$A15])^2)))*180/3.14159 -> 53.1301472312715 | E15: of:=(-ATAN((2*[.E$2]*[.$A15])/(1-([.$A15])^2)))*180/3.14159 -> 23.8134864661575
A16: 4 | B16: of:=(-ATAN((2*[.B$2]*[.$A16])/(1-([.$A16])^2)))*180/3.14159 -> 17.1048906934593 | C16: of:=(-ATAN((2*[.C$2]*[.$A16])/(1-([.$A16])^2)))*180/3.14159 -> 0 | D16: of:=(-ATAN((2*[.D$2]*[.$A16])/(1-([.$A16])^2)))*180/3.14159 -> 28.0725106476883 | E16: of:=(-ATAN((2*[.E$2]*[.$A16])/(1-([.$A16])^2)))*180/3.14159 -> 10.0114746749222
A17: 6 | B17: of:=(-ATAN((2*[.B$2]*[.$A17])/(1-([.$A17])^2)))*180/3.14159 -> 11.1902635738043 | C17: of:=(-ATAN((2*[.C$2]*[.$A17])/(1-([.$A17])^2)))*180/3.14159 -> 0 | D17: of:=(-ATAN((2*[.D$2]*[.$A17])/(1-([.$A17])^2)))*180/3.14159 -> 18.924660401028 | E17: of:=(-ATAN((2*[.E$2]*[.$A17])/(1-([.$A17])^2)))*180/3.14159 -> 6.47455748621969
A18: 8 | B18: of:=(-ATAN((2*[.B$2]*[.$A18])/(1-([.$A18])^2)))*180/3.14159 -> 8.33677605310234 | C18: of:=(-ATAN((2*[.C$2]*[.$A18])/(1-([.$A18])^2)))*180/3.14159 -> 0 | D18: of:=(-ATAN((2*[.D$2]*[.$A18])/(1-([.$A18])^2)))*180/3.14159 -> 14.2500447343015 | E18: of:=(-ATAN((2*[.E$2]*[.$A18])/(1-([.$A18])^2)))*180/3.14159 -> 4.80518972811783